{
  "schema_version": 2,
  "category": "spells",
  "source": "PHB",
  "entries": [
    {
      "ref": {
        "name": "Wall of Fire",
        "source": "PHB"
      },
      "spell_geometry": {
        "range": {
          "type": "point",
          "feet": 120
        },
        "targeting": {
          "type": "wall",
          "requires_ground": true,
          "choose_damage_side": true
        },
        "effect": {
          "geometry": {
            "shape": "wall",
            "variants": [
              {
                "type": "path",
                "max_length_feet": 60,
                "height_feet": 20,
                "thickness_feet": 1
              },
              {
                "type": "circle",
                "radius_feet": 10,
                "height_feet": 20,
                "thickness_feet": 1
              }
            ]
          },
          "persistence": "persistent",
          "damage_types": [
            "fire"
          ]
        }
      }
    }
  ]
}
