{
  "schema_version": 2,
  "category": "species",
  "source": "MPMM",
  "entries": [
    {
      "ref": {
        "name": "Aasimar",
        "source": "MPMM"
      },
      "features": [
        {
          "ref": {
            "name": "Healing Hands",
            "source": "MPMM"
          },
          "benefits": [
            {
              "type": "resource",
              "id": "aasimar:healing-hands:uses",
              "maximum": 1,
              "recharge": "long_rest"
            },
            {
              "type": "action",
              "id": "aasimar:healing-hands",
              "activation": "action",
              "resource": "aasimar:healing-hands:uses",
              "cost": 1,
              "operation": "heal_roll",
              "target": {
                "kind": "creature",
                "range_feet": 5
              },
              "dice": "proficiency*d4"
            }
          ]
        },
        {
          "ref": {
            "name": "Celestial Revelation",
            "source": "MPMM"
          },
          "min_level": 3,
          "benefits": [
            {
              "type": "resource",
              "id": "aasimar:revelation:uses",
              "maximum": 1,
              "recharge": "long_rest"
            },
            {
              "type": "option_selection",
              "id": "aasimar:revelation:form",
              "selection": {
                "id": "celestial_revelation",
                "kind": "feature_option",
                "source": {
                  "type": "inline",
                  "options": [
                    {
                      "id": "necrotic-shroud",
                      "ref": {
                        "name": "Necrotic Shroud",
                        "source": "MPMM"
                      }
                    },
                    {
                      "id": "radiant-consumption",
                      "ref": {
                        "name": "Radiant Consumption",
                        "source": "MPMM"
                      }
                    },
                    {
                      "id": "radiant-soul",
                      "ref": {
                        "name": "Radiant Soul",
                        "source": "MPMM"
                      }
                    }
                  ]
                }
              },
              "duration": {
                "rounds": 10
              }
            }
          ]
        }
      ]
    }
  ]
}
