{
  "schema_version": 2,
  "category": "classes",
  "source": "PHB",
  "entries": [
    {
      "ref": {
        "name": "Barbarian",
        "source": "PHB",
        "edition": "2014"
      },
      "features": [
        {
          "ref": {
            "name": "Rage",
            "source": "PHB",
            "level": 1
          },
          "min_level": 1,
          "benefits": [
            {
              "type": "resource",
              "id": "barbarian:rages",
              "resource": "Rages",
              "steps": [
                {
                  "level": 1,
                  "value": 2,
                  "reset": "long_rest"
                },
                {
                  "level": 3,
                  "value": 3,
                  "reset": "long_rest"
                },
                {
                  "level": 6,
                  "value": 4,
                  "reset": "long_rest"
                },
                {
                  "level": 12,
                  "value": 5,
                  "reset": "long_rest"
                },
                {
                  "level": 17,
                  "value": 6,
                  "reset": "long_rest"
                }
              ]
            },
            {
              "type": "action",
              "id": "barbarian:rage",
              "activation": "bonus",
              "operation": "toggle",
              "resource": "Rages",
              "cost": 1
            },
            {
              "type": "state",
              "id": "barbarian:rage-active",
              "requirements": {
                "expression": "rage_active"
              },
              "defenses": [
                {
                  "kind": "resistance",
                  "damage_type": "bludgeoning"
                },
                {
                  "kind": "resistance",
                  "damage_type": "piercing"
                },
                {
                  "kind": "resistance",
                  "damage_type": "slashing"
                }
              ]
            }
          ]
        },
        {
          "ref": {
            "name": "Extra Attack",
            "source": "PHB",
            "level": 5
          },
          "min_level": 5,
          "benefits": [
            {
              "type": "numeric_modifier",
              "id": "barbarian:attacks-per-action",
              "bonus": {
                "target": "attacks_per_attack_action",
                "operation": "set",
                "value": 2
              }
            }
          ]
        }
      ]
    }
  ]
}
