{
  "schema_version": 2,
  "category": "spells",
  "source": "PHB",
  "entries": [
    {
      "ref": {
        "name": "Fireball",
        "source": "PHB"
      },
      "spell_geometry": {
        "range": {
          "type": "point",
          "feet": 150
        },
        "targeting": {
          "type": "point"
        },
        "effect": {
          "geometry": {
            "shape": "sphere",
            "radius_feet": 20
          },
          "persistence": "instant",
          "damage_types": [
            "fire"
          ]
        }
      }
    }
  ]
}
