{
  "schema_version": 2,
  "category": "spells",
  "source": "PHB",
  "entries": [
    {
      "ref": {
        "name": "Thunderwave",
        "source": "PHB"
      },
      "spell_geometry": {
        "range": {
          "type": "cube",
          "feet": 15
        },
        "targeting": {
          "type": "caster_direction",
          "allow_pitch": true
        },
        "effect": {
          "geometry": {
            "shape": "cube",
            "side_feet": 15
          },
          "persistence": "instant",
          "damage_types": [
            "thunder"
          ]
        }
      },
      "spell_runtime": {
        "forced_movement_feet": 15,
        "forced_movement_mode": "away_from_caster",
        "forced_movement_on_failed_save": true
      }
    }
  ]
}
