{
  "schema_version": 2,
  "category": "items",
  "namespace": "my_campaign",
  "entries": [
    {
      "ref": {
        "id": "my_campaign:aegis-amulet",
        "homebrew_namespace": "my_campaign"
      },
      "homebrew": true,
      "name": "Amuleto dell'Egida",
      "description": "Esempio homebrew: nomi e descrizioni originali sono qui, non in 5eTools.",
      "benefits": [
        {
          "type": "numeric_modifier",
          "id": "aegis:ac",
          "requirements": {
            "attuned": true
          },
          "bonus": {
            "target": "ac",
            "operation": "add",
            "amount": 1
          }
        },
        {
          "type": "resource",
          "id": "aegis:charges",
          "maximum": 3,
          "recharge": "dawn"
        },
        {
          "type": "spell_grant",
          "id": "aegis:spell",
          "spells": [
            {
              "name": "Shield",
              "source": "PHB"
            }
          ],
          "resource": "aegis:charges",
          "cost": 1
        }
      ]
    }
  ]
}
